{
  "$schema": "./GovernancePrimitives.schema.json",
  "metadata": {
    "document_id": "governance_primitives.json",
    "title": "Governance Primitives",
    "context": "Global governance for the CLI harness. These primitives govern agent operation, execution boundaries, runtime artifact semantics, and authority separation in every target repository the harness is placed inside and invoked against.",
    "purpose": "Define and delineate global harness-level invariants from harness target repository boundaries that every project workflow must respect.",
    "source_format": "json",
    "document_authority": "global_harness"
  },
  "document_authority_classes": {
    "binding_authority": [
      "global_harness",
      "harness_target",
      "runtime_policy",
      "operational_state"
    ],
    "runtime_evidence": {
      "compiled_runtime_artifact": [
        "context_was_compiled",
        "payload_was_constructed"
      ],
      "output_policy_artifact": [
        "agent_output_was_parsed",
        "agent_output_matched_schema",
        "bounded_report_claim_was_emitted",
        "bounded_archive_record_was_emitted"
      ],
      "raw_provider_artifact": [
        "provider_returned_response",
        "audit_trace_exists"
      ],
      "validation_artifact": [
        "schema_validation_passed",
        "probe_result_recorded"
      ],
      "ledger_artifact": [
        "api_call_was_recorded",
        "route_invocation_was_recorded",
        "token_usage_was_recorded"
      ],
      "archive_record": [
        "bounded_historical_claim_was_preserved",
        "future_reports_may_cite_record_without_reconstructing_raw_artifacts"
      ]
    }
  },
  "boundary_rule": "Evidence classes may substantiate bounded runtime, validation, provenance, or historical claims. They do not create project authority, amend project intent, authorize route changes, or override binding authority.",
  "agent_contracts": [
    "project_manager",
    "planning_manager",
    "review_manager",
    "red_team_manager",
    "implementation_manager",
    "archive_manager",
    "worker_adapter"
  ],
  "approval_sensitive_surfaces": [
    "global_harness",
    "agent_contracts",
    "output_policies",
    "runtime_orchestration",
    "tool_and_worker_surface",
    "provider_or_api_behavior",
    "compatibility_commitments"
  ]
}
